{
  "schema_version": "1.0.0",
  "as_of": "2026-10-20",
  "current_period": "2026-10",
  "status_vocabulary": {
    "done": {
      "label": "Done",
      "tone": "good"
    },
    "in_progress": {
      "label": "In progress",
      "tone": "info"
    },
    "blocked": {
      "label": "Blocked",
      "tone": "bad"
    },
    "not_started": {
      "label": "Not started",
      "tone": "muted"
    },
    "deferred": {
      "label": "Deferred by decision",
      "tone": "warn"
    }
  },
  "dependency_roles": {
    "owner": {
      "label": "Owns",
      "symbol": "\u25cf",
      "note": "This system does the work and is accountable for the outcome"
    },
    "required": {
      "label": "Must change",
      "symbol": "\u25d0",
      "note": "Cannot be achieved without a change in this system"
    },
    "consumer": {
      "label": "Consumes",
      "symbol": "\u25cb",
      "note": "Affected by the outcome but requires no change"
    },
    "none": {
      "label": "\u2014",
      "symbol": "",
      "note": "Not involved"
    }
  },
  "milestones": [
    {
      "id": "M0",
      "name": "Where we actually started",
      "state": "done",
      "date": "2026-08-13",
      "summary": "10 realised trades, all losers. Expectancy \u2212367 CAD/trade, lifetime \u221215,935 CAD. The live map held one strategy that emitted zero signals when computed honestly. Honest valuation as a trading business: ~$0.",
      "plain": "The baseline, written down without flattery. Ten real trades, ten losses, and the one strategy that was live turned out to be running on a bug.",
      "falsifier": null
    },
    {
      "id": "M1",
      "name": "Honest zero",
      "state": "done",
      "date": "2026-08-14",
      "summary": "Nothing in the live map that cannot fire in real time. `Range_Stochastic_Divergence` struck off via `INTEGRITY_DISQUALIFIED`; regimes re-fit with corrected label ordering and causal smoothing (kappa \u2265 0.83); finding B re-tested against honest labels and it stands.",
      "plain": "The measured value stayed at zero \u2014 but it became a true zero. Every measurement taken after this point can be trusted, which is the only reason the rungs above it mean anything.",
      "falsifier": "If the map still routes to a strategy whose honest signal count is zero, M1 is not met regardless of what else was built."
    },
    {
      "id": "M2",
      "name": "First honest qualifier",
      "state": "done",
      "date": null,
      "summary": "Legacy technical indicator vetting resolved: single-pair indicators killed under honest friction. Research Standard v2 adopted (macro premia & Weak-Voters Committee).",
      "plain": "The question of whether tuning the old 67 indicators would yield an edge is settled: no. Edge requires macro baskets and ensemble committees.",
      "falsifier": "A qualifier that would not survive re-imposing the 60-month gate and a minimum trade count is not a qualifier; it is a sample-size artefact."
    },
    {
      "id": "M3",
      "name": "Forward test",
      "state": "done",
      "date": "2026-10-15",
      "summary": "Pipe proven end-to-end on Computer 4. Practice cutover successful 2026-10-15 with all 5 tradable strategies verified through S1 -> Queue -> S3 Guardian -> S2 Hand -> OANDA practice account. Hardened with priceBound, spread guards, rollover hold on 2026-10-18.",
      "plain": "Prove the pipe before trusting it with anything. One clearly-marked test order is sent down the whole chain; real trades then travelled the same path and filled. That part is proven. Separately, and more recently, the system paused itself on purpose while a data-quality fix to the market-regime detector is finished \u2014 the road works, but nothing is being driven down it at the moment.",
      "falsifier": "If the same `signal_id` is not visible at all three systems, the pipe is not proven, however healthy each machine looks on its own."
    },
    {
      "id": "M4",
      "name": "Verified track record",
      "state": "in_progress",
      "date": null,
      "summary": "Forward practice track record running on Computer 4. Strategy House v2 & Weak-Voters Committee in-sample qualification underway; 2023-2026 one-shot out-of-sample reserve intact.",
      "plain": "A long enough run of honest results that somebody else would take it seriously. Buyers underwrite an equity curve first and inspect the engineering second.",
      "falsifier": "A curve with a gap, a restatement, or an unexplained parameter change in the middle is not a track record."
    }
  ],
  "goals": [
    {
      "id": "G-001",
      "title": "Prove the signal pipe end to end across all three computers",
      "kind": "macro",
      "horizon": "month",
      "period": "2026-09",
      "status": "done",
      "metric": {
        "name": "Signals decided at all three systems",
        "current": 9,
        "target": 9,
        "unit": "signals",
        "note": "S2/S3 reply 2026-09-03: 9 published, 9 acked, 9 decided, 3 became real OANDA orders \u2014 all three lost, tripping System 3's circuit breaker (still open)"
      },
      "why": "Signals route `S1 \u2192 Scored_Signal_Queue \u2192 S3 \u2192 AMS_Outbound_Queue \u2192 S2`. System 1 publishes to link 1 and that is verified. Links 2 and 3 are unverified and System 1 is blind to them \u2014 its service account is publisher-only and cannot list topics or subscriptions. Nothing else about model quality can matter until a message is observed arriving.",
      "plain": "Three machines, two pipes between them. We can prove letters are going into the first pipe. Nobody has yet confirmed in writing that anyone is collecting them, or where the reply goes.",
      "definition_of_done": "A written reply from System 3 naming its subscription on `Scored_Signal_Queue`, confirming a consumer is actually pulling it, and naming the topic it publishes approved orders to. Not 'it should be set up'. Then the same `signal_id` observed at all three systems during the drill.",
      "dependencies": [
        {
          "system": "system-1",
          "role": "owner",
          "need": "Publish; raise producer cadence to at least hourly during market hours"
        },
        {
          "system": "system-2",
          "role": "required",
          "need": "Per System 2's own trace (2026-08-27): the execution engine stopped 2026-08-24T17:07:55Z alongside System 3's gate, no restart since, no exception logged. Its only runtime window this week (10:52-17:07 Monday) shows no order or fill events at all \u2014 zero OANDA fills, confirmed operational rather than risk-gate related. Supersedes the 2026-08-22 note about the local-queue path; the process is not running at all now, so that misconfiguration is moot until it restarts."
        },
        {
          "system": "system-3",
          "role": "required",
          "need": "Per System 3's own trace (2026-08-27): `ams.service.main` stopped simultaneously with System 2 at 2026-08-24T17:07:53Z, never restarted. Separately and independently of the outage: System 3 has never had a real Pub/Sub consumer running \u2014 `pubsub_signal_relay.py` has no systemd unit and no log evidence it has ever executed. `ams_decision_log` holds one entry since 2026-08-23 (Sunday's drill) and zero for Mon/Tue/Wed; none of System 1's 46 real signals this week reached System 3. Supersedes the 2026-08-22 claim of an active relay pulling 13,020 times/24h \u2014 that claim does not hold up against the decision log."
        }
      ],
      "blocked_by": null
    },
    {
      "id": "G-002",
      "title": "Raise the producer cadence to at least hourly",
      "kind": "system",
      "horizon": "month",
      "period": "2026-09",
      "status": "done",
      "metric": {
        "name": "Producer runs per trading day",
        "current": 24,
        "target": 24,
        "unit": "runs",
        "note": "Confirmed via `crontab -l` and a full week of `logs/cron_hourly_signals.log` (2026-08-24 through 2026-08-27): hourly cron at :15, 24 runs/day."
      },
      "why": "The producer fires from `cron_daily_ingest_and_signals.sh` at 22:30 on weekdays. Two of the three live strategies are H4 \u2014 six bars a day \u2014 so a once-daily batch emits signals for bars that closed up to twenty hours earlier. `src/signals/run.py` already supports a continuous 60-second loop.",
      "plain": "Trade ideas are posted once a night, but most of the strategies produce a new idea every four hours. Almost everything posted is describing a moment that has already gone.",
      "definition_of_done": "`crontab -l` shows the producer running at least hourly during market hours. Recommendation on record: hourly cron before continuous service \u2014 smaller change, restartable, matches the existing operational pattern.",
      "dependencies": [
        {
          "system": "system-1",
          "role": "owner",
          "need": "Done 2026-08-2x: hourly cron installed (`shell/cron_hourly_signals.sh`, :15 past every hour). Verified against a full week of logs \u2014 46 real signals published Mon-Wed, 0 dead-lettered."
        },
        {
          "system": "system-2",
          "role": "consumer",
          "need": ""
        },
        {
          "system": "system-3",
          "role": "consumer",
          "need": "Cadence is not cosmetic for us: the `ScoredSignal` TTL is 15 minutes. A once-daily 22:30 batch produces signals that are hours past that TTL on arrival, so they are discarded before any risk logic runs. Hourly is the minimum at which H4 signals survive the trip."
        }
      ],
      "blocked_by": null
    },
    {
      "id": "G-003",
      "title": "Resolve ADR-001 \u2014 decide where live inference runs",
      "kind": "macro",
      "horizon": "month",
      "period": "2026-09",